<?xml version="1.0" encoding="utf-8"?>
<diff xmlns:xsi="http://www.w3.org/2001/XMLSchema-instance" xsi:noNamespaceSchemaLocation="../../xsd/gamestartsdiff.xsd">
  <remove sel="//groups/group[@group='5']" />
  <add pos="before" sel="//groups/group[@group='1']">
    <group group="4" name="{20777, 2001}" />
    <group group="5" name="{20777, 2018}" />
  </add>


  <!--


  - majors -
  Galactic Empire - Bastion
  New Republic - Coruscant
  Mandalorian Death Watch - Mandalore
  Corporate Sector Authority - Cantonica
  Independent Commerce Guild - Hypori
  Hutt Cartel - Nar Shaddaa
  Imperial Ascendancy - Eriadu
  Anoat Federation - Anoat


  -->


  <add pos="before" sel="//gamestart[@id='x4ep1_sw_emp_navypilot']">
    <!-- name = title -->
    <gamestart id="gaj_empire" name="{20777,2002}" description="{20777,2003}" image="gamestart_91" group="4">
      <info>
        <item name="{1021,8}" value="{999840,600330}" /> <!-- Name -->
        <item name="{1021,1}" value="{999840,800508}" /> <!-- location -->
        <item name="{1021,2}" value="{999840,600350}" /> <!-- Ship -->
        <item name="{1021,3}" value="15000" />
      </info>
      <type name="{1021,94}" description="{1021,95}" recommendation="10" />
      <location galaxy="swi_galaxy_macro" sector="swi_clusterbastion_sector001_macro" />
      <player macro="character_player_tutorial_macro" money="15000" name="{999840,600330}">
        <ship macro="tie_fighter_van_macro">
          <loadout>
            <macros>
              <engine macro="engine_tiehd_macro" path="../con_engine_01" />
              <engine macro="engine_tiehd_macro" path="../con_engine_02" />
              <weapon macro="weapon_ls1_s_laser_macro" path="../con_weapon_01" optional="true" />
              <weapon macro="weapon_ls1_s_laser_macro" path="../con_weapon_02" optional="true" />
              <shield macro="shield_s_p12_macro" path="../con_shield_01" optional="1" />
            </macros>
            <ammunition>
              <ammunition macro="eq_arg_satellite_01_macro" exact="5" optional="true" />
              <ammunition macro="env_deco_nav_beacon_t1_macro" exact="5" optional="true" />
            </ammunition>
            <software>
              <software ware="software_flightassistmk1" />
              <software ware="software_scannerlongrangemk1" />
              <software ware="software_scannerobjectmk1" />
              <software ware="software_targetmk1" />
            </software>
            <virtualmacros>
              <thruster macro="thruster_gen_s_allround_01_mk1_macro" />
            </virtualmacros>
          </loadout>
        </ship>
        <inventory>
          <ware ware="weapon_gen_spacesuit_repairlaser_01_mk1" amount="1" />
          <ware ware="software_scannerobjectmk3" amount="1" />
          <ware ware="inv_timewarp" amount="1" />
        </inventory>
        <blueprints>
          <ware ware="clothingmod_0001" />
          <ware ware="clothingmod_0002" />
          <ware ware="dockarea_imp_m_station_01_hightech" />
          <ware ware="pier_imp_harbor_01" />
          <ware ware="storage_imp_s_container_01" />
          <ware ware="struct_imp_base_01" />
          <ware ware="struct_imp_cross_01" />
          <ware ware="struct_imp_vertical_01" />
          <ware ware="prod_imp_energycells" />
          <ware ware="paintmod_0006" />
          <ware ware="paintmod_0048" />
          <ware ware="paintmod_0049" />
          <ware ware="paintmod_0050" />
          <ware ware="paintmod_0097" />
          <ware ware="paintmod_0098" />
          <ware ware="paintmod_0099" />
          <ware ware="paintmod_0100" />
        </blueprints>
        <research>
          <ware ware="research_teleportation" />
          <ware ware="research_radioreceiver" />
          <ware ware="research_sensorbooster" />
          <ware ware="research_tradeinterface" />
          <ware ware="research_mod_engine_mk1" />
          <ware ware="research_mod_shield_mk1" />
          <ware ware="research_mod_ship_mk1" />
          <ware ware="research_mod_weapon_mk1" />
          <ware ware="research_module_welfare_1_pre" />
          <ware ware="research_module_welfare_1" />
        </research>
        <encyclopedia>
          <entry type="warebasket" ref="research_gamestart_common" />
        </encyclopedia>
        <theme paint="painttheme_player_01" />
      </player>
      <universe>
        <factions>
          <relations>
            <relation faction="galempire" otherfaction="player" relation="0.01593" />
          </relations>
        </factions>
      </universe>
    </gamestart>

    <gamestart id="gaj_republic" name="{20777,2004}" description="{20777,2005}" image="gamestart_14" group="4">
      <info>
        <item name="{1021,8}" value="{999840,600130}" />
        <item name="{1021,1}" value="{999840,800503}" />
        <item name="{1021,2}" value="{999840,600150}" />
        <item name="{1021,3}" value="15000" />
      </info>
      <type name="{1021,94}" description="{1021,95}" recommendation="10" />
      <location galaxy="swi_galaxy_macro" sector="swi_clustercoruscant_sector001_macro" />
      <player macro="character_player_tutorial_macro" money="15000" name="{999840,600130}">
        <ship macro="ewing_macro">
          <loadout>
            <macros>
              <engine macro="engine_incom_macro" path="../con_engine_01" />
              <engine macro="engine_incom_macro" path="../con_engine_02" />
              <weapon macro="weapon_kx5_s_laser_macro" path="../con_weapon_01" optional="true" />
              <weapon macro="weapon_kx5_s_laser_macro" path="../con_weapon_02" optional="true" />
              <weapon macro="weapon_kx5_s_laser_macro" path="../con_weapon_03" optional="true" />
              <shield macro="shield_s_p12_macro" path="../con_shield_01" optional="true" />
            </macros>
            <ammunition>
              <ammunition macro="eq_arg_satellite_01_macro" exact="5" optional="true" />
              <ammunition macro="env_deco_nav_beacon_t1_macro" exact="5" optional="true" />
              <ammunition macro="eq_arg_resourceprobe_01_macro" exact="5" optional="true" />
            </ammunition>
            <software>
              <software ware="software_flightassistmk1" />
              <software ware="software_scannerlongrangemk1" />
              <software ware="software_scannerobjectmk1" />
              <software ware="software_targetmk1" />
            </software>
            <virtualmacros>
              <thruster macro="thruster_gen_s_allround_01_mk1_macro" />
            </virtualmacros>
          </loadout>
        </ship>
        <inventory>
          <ware ware="weapon_gen_spacesuit_repairlaser_01_mk1" amount="1" />
          <ware ware="software_scannerobjectmk3" amount="1" />
          <ware ware="inv_timewarp" amount="1" />
        </inventory>
        <blueprints>
          <ware ware="clothingmod_0001" />
          <ware ware="clothingmod_0002" />
          <ware ware="module_arg_dock_m_01_lowtech" />
          <ware ware="module_arg_pier_l_01" />
          <ware ware="module_arg_stor_container_s_01" />
          <ware ware="module_arg_conn_base_01" />
          <ware ware="module_arg_conn_cross_01" />
          <ware ware="module_arg_conn_vertical_01" />
          <ware ware="module_gen_prod_energycells_01" />
          <ware ware="module_arg_prod_meat_01" />
          <ware ware="paintmod_0006" />
          <ware ware="paintmod_0048" />
          <ware ware="paintmod_0049" />
          <ware ware="paintmod_0050" />
          <ware ware="paintmod_0097" />
          <ware ware="paintmod_0098" />
          <ware ware="paintmod_0099" />
          <ware ware="paintmod_0100" />
        </blueprints>
        <research>
          <ware ware="research_teleportation" />
          <ware ware="research_radioreceiver" />
          <ware ware="research_sensorbooster" />
          <ware ware="research_tradeinterface" />
          <ware ware="research_mod_engine_mk1" />
          <ware ware="research_mod_shield_mk1" />
          <ware ware="research_mod_ship_mk1" />
          <ware ware="research_mod_weapon_mk1" />
          <ware ware="research_module_welfare_1_pre" />
          <ware ware="research_module_welfare_1" />

        </research>
        <encyclopedia>
          <entry type="warebasket" ref="research_gamestart_common" />
        </encyclopedia>
        <theme paint="painttheme_player_01" />
      </player>
      <universe>
        <factions>
          <relations>
            <relation faction="newrepublic" otherfaction="player" relation="0.01593" />
          </relations>
        </factions>
      </universe>
    </gamestart>

    <gamestart id="gaj_mando" name="{20777,2006}" description="{20777,2007}" image="gamestart_mando" group="4">
      <info>
        <item name="{1021,8}" value="{999840,600830}" />
        <item name="{1021,1}" value="{999840,911201}" />
        <item name="{1021,2}" value="{999840,600850}" />
        <item name="{1021,3}" value="15000" />
      </info>
      <type name="{1021,94}" description="{1021,95}" />
      <location galaxy="swi_galaxy_macro" sector="swi_clustermandalore_sector001_macro" />
      <player macro="character_player_split_gamestart2_macro" money="15000" name="{999840,600830}">
        <ship macro="m4_dune_macro">
          <loadout>
            <macros>
              <engine macro="engine_incom_macro" path="../con_engine_01" />
              <weapon macro="weapon_gatling_macro" path="../con_weapon_01" />
              <weapon macro="weapon_gatling_macro" path="../con_weapon_02" />
              <weapon macro="weapon_blaster_s_laser_macro" path="../con_weapon_03" />
              <weapon macro="weapon_blaster_s_laser_macro" path="../con_weapon_04" />